{
  "$schema": "https://json-schema.org/draft/2020-12/schema",
  "$id": "meal-planner-app/meal-proposal.schema.json",
  "title": "AI献立提案ファイル（schemaVersion 1）",
  "description": "仕様は docs/MEAL_PROPOSAL_FORMAT.md。日付の実在・期間（1〜14日）・期間内の日付・日付と料理IDの重複・proposalIdとファイル名の一致は、このスキーマでは表せないため scripts/mealProposalFormat.mjs で確認する。",
  "type": "object",
  "additionalProperties": false,
  "required": ["schemaVersion", "proposalId", "periodStart", "periodEnd", "createdAt", "generator", "days"],
  "properties": {
    "schemaVersion": { "const": 1 },
    "proposalId": { "$ref": "#/$defs/date", "description": "periodStart と同じ日付" },
    "periodStart": { "$ref": "#/$defs/date" },
    "periodEnd": { "$ref": "#/$defs/date" },
    "createdAt": { "type": "string", "pattern": "^\\d{4}-\\d{2}-\\d{2}T\\d{2}:\\d{2}:\\d{2}\\+09:00$" },
    "generator": { "const": "codex" },
    "basedOn": {
      "type": "object",
      "additionalProperties": false,
      "properties": { "coopOrderDate": { "$ref": "#/$defs/date" } }
    },
    "comment": { "$ref": "#/$defs/text", "maxLength": 200 },
    "days": {
      "type": "array",
      "minItems": 1,
      "maxItems": 14,
      "items": {
        "type": "object",
        "additionalProperties": false,
        "required": ["date", "dishes"],
        "properties": {
          "date": { "$ref": "#/$defs/date" },
          "dishes": { "type": "array", "minItems": 1, "maxItems": 10, "items": { "$ref": "#/$defs/dish" } }
        }
      }
    }
  },
  "$defs": {
    "date": { "type": "string", "pattern": "^\\d{4}-\\d{2}-\\d{2}$" },
    "text": { "type": "string", "minLength": 1, "pattern": "^\\S(.*\\S)?$" },
    "dish": {
      "type": "object",
      "additionalProperties": false,
      "required": ["id", "name", "role", "ingredients", "steps"],
      "properties": {
        "id": { "$ref": "#/$defs/text", "maxLength": 40 },
        "name": { "$ref": "#/$defs/text", "maxLength": 40, "not": { "pattern": "[｜|]" } },
        "role": { "enum": ["main", "side", "soup", "other"] },
        "ingredients": { "type": "array", "minItems": 1, "maxItems": 40, "items": { "$ref": "#/$defs/text", "maxLength": 100 } },
        "steps": { "type": "array", "minItems": 1, "maxItems": 30, "items": { "$ref": "#/$defs/text", "maxLength": 300 } },
        "coopItems": { "type": "array", "maxItems": 20, "items": { "$ref": "#/$defs/text", "maxLength": 60 } },
        "note": { "$ref": "#/$defs/text", "maxLength": 50 }
      }
    }
  }
}
