{
  "schemaVersion": 1,
  "proposalId": "2026-10-30",
  "periodStart": "2026-10-30",
  "periodEnd": "2026-10-31",
  "createdAt": "2026-10-28T21:00:00+09:00",
  "generator": "codex",
  "basedOn": { "coopOrderDate": "2026-10-30" },
  "comment": "鮭と白菜が多めなので、前半で使い切る構成にしました",
  "days": [
    {
      "date": "2026-10-30",
      "dishes": [
        {
          "id": "d1",
          "name": "鮭のちゃんちゃん焼き",
          "role": "main",
          "ingredients": ["生鮭 2切れ", "キャベツ 1/4個", "玉ねぎ 1/2個", "味噌 大さじ2", "みりん 大さじ1", "バター 10g"],
          "steps": ["キャベツはざく切り、玉ねぎは薄切りにする", "味噌とみりんを混ぜておく", "フライパンに野菜を敷き、鮭をのせて合わせ味噌をかける", "ふたをして中火で8分蒸し焼きにし、バターをのせる"],
          "coopItems": ["生鮭", "キャベツ"],
          "note": "15分"
        },
        {
          "id": "d2",
          "name": "白菜と油揚げの味噌汁",
          "role": "soup",
          "ingredients": ["白菜 2枚", "油揚げ 1/2枚", "だし汁 400ml", "味噌 大さじ2"],
          "steps": ["白菜と油揚げを食べやすく切る", "だし汁で白菜を煮て、油揚げを加える", "火を止めて味噌を溶き入れる"],
          "coopItems": ["白菜"]
        }
      ]
    },
    {
      "date": "2026-10-31",
      "dishes": [
        {
          "id": "d3",
          "name": "白菜と豚肉のうま煮",
          "role": "main",
          "ingredients": ["白菜 1/8個", "豚こま切れ肉 200g", "鶏がらスープの素 小さじ2", "水 150ml", "片栗粉 大さじ1"],
          "steps": ["白菜はざく切りにする", "豚肉を炒め、白菜を加えて炒める", "水とスープの素を入れて5分煮る", "水溶き片栗粉でとろみをつける"],
          "coopItems": ["白菜", "豚こま切れ肉"],
          "note": "20分"
        }
      ]
    }
  ]
}
